[
  {
    "ruleId": "GENSHIN_STYGIAN_ONSLAUGHT",
    "scheduledStart": "2026-09-30",
    "startsOn": "2026-09-30",
    "startTime": "04:00:00",
    "endsOn": "2026-11-03",
    "endTime": "03:59:00",
    "suppressed": false,
    "notes": "User-provided 7.1/1.4 activity calendar image"
  },
  {
    "ruleId": "GENSHIN_IMAGINARIUM_THEATER",
    "scheduledStart": "2026-10-01",
    "startsOn": "2026-10-01",
    "startTime": "04:00:00",
    "endsOn": "2026-11-01",
    "endTime": "03:59:00",
    "suppressed": false,
    "notes": "User-provided 7.1/1.4 activity calendar image"
  }
]
